No.     Time           Source                Destination           Protocol Length Info
      1 0.000000000    127.0.0.1             127.0.1.1             DNS      77     Standard query 0x3eae A mirror.azure.cn

Frame 1: 77 bytes on wire (616 bits), 77 bytes captured (616 bits) on interface 0
    Interface id: 0 (any)
        Interface name: any
    Encapsulation type: Linux cooked-mode capture (25)
    Arrival Time: Aug  5, 2019 14:42:31.501175737 CST
    [Time shift for this packet: 0.000000000 seconds]
    Epoch Time: 1564987351.501175737 seconds
    [Time delta from previous captured frame: 0.000000000 seconds]
    [Time delta from previous displayed frame: 0.000000000 seconds]
    [Time since reference or first frame: 0.000000000 seconds]
    Frame Number: 1
    Frame Length: 77 bytes (616 bits)
    Capture Length: 77 bytes (616 bits)
    [Frame is marked: False]
    [Frame is ignored: False]
    [Protocols in frame: sll:ethertype:ip:udp:dns]
    [Coloring Rule Name: UDP]
    [Coloring Rule String: udp]
Linux cooked capture
    Packet type: Unicast to us (0)
    Link-layer address type: 772
    Link-layer address length: 6
    Source: 00:00:00_00:00:00 (00:00:00:00:00:00)
    Unused: 0000
    Protocol: IPv4 (0x0800)
Internet Protocol Version 4, Src: 127.0.0.1, Dst: 127.0.1.1
    0100 .... = Version: 4
    .... 0101 = Header Length: 20 bytes (5)
    Differentiated Services Field: 0x00 (DSCP: CS0, ECN: Not-ECT)
        0000 00.. = Differentiated Services Codepoint: Default (0)
        .... ..00 = Explicit Congestion Notification: Not ECN-Capable Transport (0)
    Total Length: 61
    Identification: 0x2136 (8502)
    Flags: 0x4000, Don't fragment
        0... .... .... .... = Reserved bit: Not set
        .1.. .... .... .... = Don't fragment: Set
        ..0. .... .... .... = More fragments: Not set
        ...0 0000 0000 0000 = Fragment offset: 0
    Time to live: 64
    Protocol: UDP (17)
    Header checksum: 0x1a78 [validation disabled]
    [Header checksum status: Unverified]
    Source: 127.0.0.1
    Destination: 127.0.1.1
User Datagram Protocol, Src Port: 40723, Dst Port: 53
    Source Port: 40723
    Destination Port: 53
    Length: 41
    Checksum: 0xff3c [unverified]
    [Checksum Status: Unverified]
    [Stream index: 0]
    [Timestamps]
        [Time since first frame: 0.000000000 seconds]
        [Time since previous frame: 0.000000000 seconds]
Domain Name System (query)
    Transaction ID: 0x3eae
    Flags: 0x0100 Standard query
        0... .... .... .... = Response: Message is a query
        .000 0... .... .... = Opcode: Standard query (0)
        .... ..0. .... .... = Truncated: Message is not truncated
        .... ...1 .... .... = Recursion desired: Do query recursively
        .... .... .0.. .... = Z: reserved (0)
        .... .... ...0 .... = Non-authenticated data: Unacceptable
    Questions: 1
    Answer RRs: 0
    Authority RRs: 0
    Additional RRs: 0
    Queries
        mirror.azure.cn: type A, class IN
            Name: mirror.azure.cn
            [Name Length: 15]
            [Label Count: 3]
            Type: A (Host Address) (1)
            Class: IN (0x0001)
    [Response In: 7]

No.     Time           Source                Destination           Protocol Length Info
      2 0.000193171    10.11.29.131          210.22.70.3           DNS      77     Standard query 0x799c A mirror.azure.cn

Frame 2: 77 bytes on wire (616 bits), 77 bytes captured (616 bits) on interface 0
    Interface id: 0 (any)
        Interface name: any
    Encapsulation type: Linux cooked-mode capture (25)
    Arrival Time: Aug  5, 2019 14:42:31.501368908 CST
    [Time shift for this packet: 0.000000000 seconds]
    Epoch Time: 1564987351.501368908 seconds
    [Time delta from previous captured frame: 0.000193171 seconds]
    [Time delta from previous displayed frame: 0.000193171 seconds]
    [Time since reference or first frame: 0.000193171 seconds]
    Frame Number: 2
    Frame Length: 77 bytes (616 bits)
    Capture Length: 77 bytes (616 bits)
    [Frame is marked: False]
    [Frame is ignored: False]
    [Protocols in frame: sll:ethertype:ip:udp:dns]
    [Coloring Rule Name: UDP]
    [Coloring Rule String: udp]
Linux cooked capture
    Packet type: Sent by us (4)
    Link-layer address type: 1
    Link-layer address length: 6
    Source: Dell_ca:f9:c7 (6c:2b:59:ca:f9:c7)
    Unused: 0000
    Protocol: IPv4 (0x0800)
Internet Protocol Version 4, Src: 10.11.29.131, Dst: 210.22.70.3
    0100 .... = Version: 4
    .... 0101 = Header Length: 20 bytes (5)
    Differentiated Services Field: 0x00 (DSCP: CS0, ECN: Not-ECT)
        0000 00.. = Differentiated Services Codepoint: Default (0)
        .... ..00 = Explicit Congestion Notification: Not ECN-Capable Transport (0)
    Total Length: 61
    Identification: 0x044f (1103)
    Flags: 0x4000, Don't fragment
        0... .... .... .... = Reserved bit: Not set
        .1.. .... .... .... = Don't fragment: Set
        ..0. .... .... .... = More fragments: Not set
        ...0 0000 0000 0000 = Fragment offset: 0
    Time to live: 64
    Protocol: UDP (17)
    Header checksum: 0xf6b9 [validation disabled]
    [Header checksum status: Unverified]
    Source: 10.11.29.131
    Destination: 210.22.70.3
User Datagram Protocol, Src Port: 58768, Dst Port: 53
    Source Port: 58768
    Destination Port: 53
    Length: 41
    Checksum: 0x3fe2 [unverified]
    [Checksum Status: Unverified]
    [Stream index: 1]
    [Timestamps]
        [Time since first frame: 0.000000000 seconds]
        [Time since previous frame: 0.000000000 seconds]
Domain Name System (query)
    Transaction ID: 0x799c
    Flags: 0x0100 Standard query
        0... .... .... .... = Response: Message is a query
        .000 0... .... .... = Opcode: Standard query (0)
        .... ..0. .... .... = Truncated: Message is not truncated
        .... ...1 .... .... = Recursion desired: Do query recursively
        .... .... .0.. .... = Z: reserved (0)
        .... .... ...0 .... = Non-authenticated data: Unacceptable
    Questions: 1
    Answer RRs: 0
    Authority RRs: 0
    Additional RRs: 0
    Queries
        mirror.azure.cn: type A, class IN
            Name: mirror.azure.cn
            [Name Length: 15]
            [Label Count: 3]
            Type: A (Host Address) (1)
            Class: IN (0x0001)
    [Response In: 6]

No.     Time           Source                Destination           Protocol Length Info
      3 0.000214658    10.11.29.131          210.22.84.3           DNS      77     Standard query 0x799c A mirror.azure.cn

Frame 3: 77 bytes on wire (616 bits), 77 bytes captured (616 bits) on interface 0
    Interface id: 0 (any)
        Interface name: any
    Encapsulation type: Linux cooked-mode capture (25)
    Arrival Time: Aug  5, 2019 14:42:31.501390395 CST
    [Time shift for this packet: 0.000000000 seconds]
    Epoch Time: 1564987351.501390395 seconds
    [Time delta from previous captured frame: 0.000021487 seconds]
    [Time delta from previous displayed frame: 0.000021487 seconds]
    [Time since reference or first frame: 0.000214658 seconds]
    Frame Number: 3
    Frame Length: 77 bytes (616 bits)
    Capture Length: 77 bytes (616 bits)
    [Frame is marked: False]
    [Frame is ignored: False]
    [Protocols in frame: sll:ethertype:ip:udp:dns]
    [Coloring Rule Name: UDP]
    [Coloring Rule String: udp]
Linux cooked capture
    Packet type: Sent by us (4)
    Link-layer address type: 1
    Link-layer address length: 6
    Source: Dell_ca:f9:c7 (6c:2b:59:ca:f9:c7)
    Unused: 0000
    Protocol: IPv4 (0x0800)
Internet Protocol Version 4, Src: 10.11.29.131, Dst: 210.22.84.3
    0100 .... = Version: 4
    .... 0101 = Header Length: 20 bytes (5)
    Differentiated Services Field: 0x00 (DSCP: CS0, ECN: Not-ECT)
        0000 00.. = Differentiated Services Codepoint: Default (0)
        .... ..00 = Explicit Congestion Notification: Not ECN-Capable Transport (0)
    Total Length: 61
    Identification: 0x5ca4 (23716)
    Flags: 0x4000, Don't fragment
        0... .... .... .... = Reserved bit: Not set
        .1.. .... .... .... = Don't fragment: Set
        ..0. .... .... .... = More fragments: Not set
        ...0 0000 0000 0000 = Fragment offset: 0
    Time to live: 64
    Protocol: UDP (17)
    Header checksum: 0x9064 [validation disabled]
    [Header checksum status: Unverified]
    Source: 10.11.29.131
    Destination: 210.22.84.3
User Datagram Protocol, Src Port: 58768, Dst Port: 53
    Source Port: 58768
    Destination Port: 53
    Length: 41
    Checksum: 0x4de2 [unverified]
    [Checksum Status: Unverified]
    [Stream index: 2]
    [Timestamps]
        [Time since first frame: 0.000000000 seconds]
        [Time since previous frame: 0.000000000 seconds]
Domain Name System (query)
    Transaction ID: 0x799c
    Flags: 0x0100 Standard query
        0... .... .... .... = Response: Message is a query
        .000 0... .... .... = Opcode: Standard query (0)
        .... ..0. .... .... = Truncated: Message is not truncated
        .... ...1 .... .... = Recursion desired: Do query recursively
        .... .... .0.. .... = Z: reserved (0)
        .... .... ...0 .... = Non-authenticated data: Unacceptable
    Questions: 1
    Answer RRs: 0
    Authority RRs: 0
    Additional RRs: 0
    Queries
        mirror.azure.cn: type A, class IN
            Name: mirror.azure.cn
            [Name Length: 15]
            [Label Count: 3]
            Type: A (Host Address) (1)
            Class: IN (0x0001)
    [Response In: 5]

No.     Time           Source                Destination           Protocol Length Info
      4 0.000237609    10.11.29.131          114.114.114.114       DNS      77     Standard query 0x799c A mirror.azure.cn

Frame 4: 77 bytes on wire (616 bits), 77 bytes captured (616 bits) on interface 0
    Interface id: 0 (any)
        Interface name: any
    Encapsulation type: Linux cooked-mode capture (25)
    Arrival Time: Aug  5, 2019 14:42:31.501413346 CST
    [Time shift for this packet: 0.000000000 seconds]
    Epoch Time: 1564987351.501413346 seconds
    [Time delta from previous captured frame: 0.000022951 seconds]
    [Time delta from previous displayed frame: 0.000022951 seconds]
    [Time since reference or first frame: 0.000237609 seconds]
    Frame Number: 4
    Frame Length: 77 bytes (616 bits)
    Capture Length: 77 bytes (616 bits)
    [Frame is marked: False]
    [Frame is ignored: False]
    [Protocols in frame: sll:ethertype:ip:udp:dns]
    [Coloring Rule Name: UDP]
    [Coloring Rule String: udp]
Linux cooked capture
    Packet type: Sent by us (4)
    Link-layer address type: 1
    Link-layer address length: 6
    Source: Dell_ca:f9:c7 (6c:2b:59:ca:f9:c7)
    Unused: 0000
    Protocol: IPv4 (0x0800)
Internet Protocol Version 4, Src: 10.11.29.131, Dst: 114.114.114.114
    0100 .... = Version: 4
    .... 0101 = Header Length: 20 bytes (5)
    Differentiated Services Field: 0x00 (DSCP: CS0, ECN: Not-ECT)
        0000 00.. = Differentiated Services Codepoint: Default (0)
        .... ..00 = Explicit Congestion Notification: Not ECN-Capable Transport (0)
    Total Length: 61
    Identification: 0xc8d9 (51417)
    Flags: 0x4000, Don't fragment
        0... .... .... .... = Reserved bit: Not set
        .1.. .... .... .... = Don't fragment: Set
        ..0. .... .... .... = More fragments: Not set
        ...0 0000 0000 0000 = Fragment offset: 0
    Time to live: 64
    Protocol: UDP (17)
    Header checksum: 0x6564 [validation disabled]
    [Header checksum status: Unverified]
    Source: 10.11.29.131
    Destination: 114.114.114.114
User Datagram Protocol, Src Port: 58768, Dst Port: 53
    Source Port: 58768
    Destination Port: 53
    Length: 41
    Checksum: 0x0cad [unverified]
    [Checksum Status: Unverified]
    [Stream index: 3]
    [Timestamps]
        [Time since first frame: 0.000000000 seconds]
        [Time since previous frame: 0.000000000 seconds]
Domain Name System (query)
    Transaction ID: 0x799c
    Flags: 0x0100 Standard query
        0... .... .... .... = Response: Message is a query
        .000 0... .... .... = Opcode: Standard query (0)
        .... ..0. .... .... = Truncated: Message is not truncated
        .... ...1 .... .... = Recursion desired: Do query recursively
        .... .... .0.. .... = Z: reserved (0)
        .... .... ...0 .... = Non-authenticated data: Unacceptable
    Questions: 1
    Answer RRs: 0
    Authority RRs: 0
    Additional RRs: 0
    Queries
        mirror.azure.cn: type A, class IN
            Name: mirror.azure.cn
            [Name Length: 15]
            [Label Count: 3]
            Type: A (Host Address) (1)
            Class: IN (0x0001)
    [Response In: 25]

No.     Time           Source                Destination           Protocol Length Info
      5 0.003621049    210.22.84.3           10.11.29.131          DNS      168    Standard query response 0x799c A mirror.azure.cn CNAME mirror.trafficmanager.cn CNAME eastmirror.chinacloudapp.cn A 139.217.146.62

Frame 5: 168 bytes on wire (1344 bits), 168 bytes captured (1344 bits) on interface 0
    Interface id: 0 (any)
        Interface name: any
    Encapsulation type: Linux cooked-mode capture (25)
    Arrival Time: Aug  5, 2019 14:42:31.504796786 CST
    [Time shift for this packet: 0.000000000 seconds]
    Epoch Time: 1564987351.504796786 seconds
    [Time delta from previous captured frame: 0.003383440 seconds]
    [Time delta from previous displayed frame: 0.003383440 seconds]
    [Time since reference or first frame: 0.003621049 seconds]
    Frame Number: 5
    Frame Length: 168 bytes (1344 bits)
    Capture Length: 168 bytes (1344 bits)
    [Frame is marked: False]
    [Frame is ignored: False]
    [Protocols in frame: sll:ethertype:ip:udp:dns]
    [Coloring Rule Name: UDP]
    [Coloring Rule String: udp]
Linux cooked capture
    Packet type: Unicast to us (0)
    Link-layer address type: 1
    Link-layer address length: 6
    Source: JuniperN_ff:10:02 (00:10:db:ff:10:02)
    Unused: 0000
    Protocol: IPv4 (0x0800)
Internet Protocol Version 4, Src: 210.22.84.3, Dst: 10.11.29.131
    0100 .... = Version: 4
    .... 0101 = Header Length: 20 bytes (5)
    Differentiated Services Field: 0x00 (DSCP: CS0, ECN: Not-ECT)
        0000 00.. = Differentiated Services Codepoint: Default (0)
        .... ..00 = Explicit Congestion Notification: Not ECN-Capable Transport (0)
    Total Length: 152
    Identification: 0x0000 (0)
    Flags: 0x0000
        0... .... .... .... = Reserved bit: Not set
        .0.. .... .... .... = Don't fragment: Not set
        ..0. .... .... .... = More fragments: Not set
        ...0 0000 0000 0000 = Fragment offset: 0
    Time to live: 150
    Protocol: UDP (17)
    Header checksum: 0xd6ad [validation disabled]
    [Header checksum status: Unverified]
    Source: 210.22.84.3
    Destination: 10.11.29.131
User Datagram Protocol, Src Port: 53, Dst Port: 58768
    Source Port: 53
    Destination Port: 58768
    Length: 132
    Checksum: 0x5366 [unverified]
    [Checksum Status: Unverified]
    [Stream index: 2]
    [Timestamps]
        [Time since first frame: 0.003406391 seconds]
        [Time since previous frame: 0.003406391 seconds]
Domain Name System (response)
    Transaction ID: 0x799c
    Flags: 0x8180 Standard query response, No error
        1... .... .... .... = Response: Message is a response
        .000 0... .... .... = Opcode: Standard query (0)
        .... .0.. .... .... = Authoritative: Server is not an authority for domain
        .... ..0. .... .... = Truncated: Message is not truncated
        .... ...1 .... .... = Recursion desired: Do query recursively
        .... .... 1... .... = Recursion available: Server can do recursive queries
        .... .... .0.. .... = Z: reserved (0)
        .... .... ..0. .... = Answer authenticated: Answer/authority portion was not authenticated by the server
        .... .... ...0 .... = Non-authenticated data: Unacceptable
        .... .... .... 0000 = Reply code: No error (0)
    Questions: 1
    Answer RRs: 3
    Authority RRs: 0
    Additional RRs: 0
    Queries
        mirror.azure.cn: type A, class IN
            Name: mirror.azure.cn
            [Name Length: 15]
            [Label Count: 3]
            Type: A (Host Address) (1)
            Class: IN (0x0001)
    Answers
        mirror.azure.cn: type CNAME, class IN, cname mirror.trafficmanager.cn
            Name: mirror.azure.cn
            Type: CNAME (Canonical NAME for an alias) (5)
            Class: IN (0x0001)
            Time to live: 3344
            Data length: 24
            CNAME: mirror.trafficmanager.cn
        mirror.trafficmanager.cn: type CNAME, class IN, cname eastmirror.chinacloudapp.cn
            Name: mirror.trafficmanager.cn
            Type: CNAME (Canonical NAME for an alias) (5)
            Class: IN (0x0001)
            Time to live: 60
            Data length: 27
            CNAME: eastmirror.chinacloudapp.cn
        eastmirror.chinacloudapp.cn: type A, class IN, addr 139.217.146.62
            Name: eastmirror.chinacloudapp.cn
            Type: A (Host Address) (1)
            Class: IN (0x0001)
            Time to live: 60
            Data length: 4
            Address: 139.217.146.62
    [Request In: 3]
    [Time: 0.003406391 seconds]

No.     Time           Source                Destination           Protocol Length Info
      6 0.003673107    210.22.70.3           10.11.29.131          DNS      168    Standard query response 0x799c A mirror.azure.cn CNAME mirror.trafficmanager.cn CNAME eastmirror.chinacloudapp.cn A 139.217.146.62

Frame 6: 168 bytes on wire (1344 bits), 168 bytes captured (1344 bits) on interface 0
    Interface id: 0 (any)
        Interface name: any
    Encapsulation type: Linux cooked-mode capture (25)
    Arrival Time: Aug  5, 2019 14:42:31.504848844 CST
    [Time shift for this packet: 0.000000000 seconds]
    Epoch Time: 1564987351.504848844 seconds
    [Time delta from previous captured frame: 0.000052058 seconds]
    [Time delta from previous displayed frame: 0.000052058 seconds]
    [Time since reference or first frame: 0.003673107 seconds]
    Frame Number: 6
    Frame Length: 168 bytes (1344 bits)
    Capture Length: 168 bytes (1344 bits)
    [Frame is marked: False]
    [Frame is ignored: False]
    [Protocols in frame: sll:ethertype:ip:udp:dns]
    [Coloring Rule Name: UDP]
    [Coloring Rule String: udp]
Linux cooked capture
    Packet type: Unicast to us (0)
    Link-layer address type: 1
    Link-layer address length: 6
    Source: JuniperN_ff:10:02 (00:10:db:ff:10:02)
    Unused: 0000
    Protocol: IPv4 (0x0800)
Internet Protocol Version 4, Src: 210.22.70.3, Dst: 10.11.29.131
    0100 .... = Version: 4
    .... 0101 = Header Length: 20 bytes (5)
    Differentiated Services Field: 0x00 (DSCP: CS0, ECN: Not-ECT)
        0000 00.. = Differentiated Services Codepoint: Default (0)
        .... ..00 = Explicit Congestion Notification: Not ECN-Capable Transport (0)
    Total Length: 152
    Identification: 0x0000 (0)
    Flags: 0x0000
        0... .... .... .... = Reserved bit: Not set
        .0.. .... .... .... = Don't fragment: Not set
        ..0. .... .... .... = More fragments: Not set
        ...0 0000 0000 0000 = Fragment offset: 0
    Time to live: 150
    Protocol: UDP (17)
    Header checksum: 0xe4ad [validation disabled]
    [Header checksum status: Unverified]
    Source: 210.22.70.3
    Destination: 10.11.29.131
User Datagram Protocol, Src Port: 53, Dst Port: 58768
    Source Port: 53
    Destination Port: 58768
    Length: 132
    Checksum: 0x896d [unverified]
    [Checksum Status: Unverified]
    [Stream index: 1]
    [Timestamps]
        [Time since first frame: 0.003479936 seconds]
        [Time since previous frame: 0.003479936 seconds]
Domain Name System (response)
    Transaction ID: 0x799c
    Flags: 0x8180 Standard query response, No error
        1... .... .... .... = Response: Message is a response
        .000 0... .... .... = Opcode: Standard query (0)
        .... .0.. .... .... = Authoritative: Server is not an authority for domain
        .... ..0. .... .... = Truncated: Message is not truncated
        .... ...1 .... .... = Recursion desired: Do query recursively
        .... .... 1... .... = Recursion available: Server can do recursive queries
        .... .... .0.. .... = Z: reserved (0)
        .... .... ..0. .... = Answer authenticated: Answer/authority portion was not authenticated by the server
        .... .... ...0 .... = Non-authenticated data: Unacceptable
        .... .... .... 0000 = Reply code: No error (0)
    Questions: 1
    Answer RRs: 3
    Authority RRs: 0
    Additional RRs: 0
    Queries
        mirror.azure.cn: type A, class IN
            Name: mirror.azure.cn
            [Name Length: 15]
            [Label Count: 3]
            Type: A (Host Address) (1)
            Class: IN (0x0001)
    Answers
        mirror.azure.cn: type CNAME, class IN, cname mirror.trafficmanager.cn
            Name: mirror.azure.cn
            Type: CNAME (Canonical NAME for an alias) (5)
            Class: IN (0x0001)
            Time to live: 3332
            Data length: 24
            CNAME: mirror.trafficmanager.cn
        mirror.trafficmanager.cn: type CNAME, class IN, cname eastmirror.chinacloudapp.cn
            Name: mirror.trafficmanager.cn
            Type: CNAME (Canonical NAME for an alias) (5)
            Class: IN (0x0001)
            Time to live: 32
            Data length: 27
            CNAME: eastmirror.chinacloudapp.cn
        eastmirror.chinacloudapp.cn: type A, class IN, addr 139.217.146.62
            Name: eastmirror.chinacloudapp.cn
            Type: A (Host Address) (1)
            Class: IN (0x0001)
            Time to live: 53
            Data length: 4
            Address: 139.217.146.62
    [Request In: 2]
    [Time: 0.003479936 seconds]

No.     Time           Source                Destination           Protocol Length Info
      7 0.003748760    127.0.1.1             127.0.0.1             DNS      168    Standard query response 0x3eae A mirror.azure.cn CNAME mirror.trafficmanager.cn CNAME eastmirror.chinacloudapp.cn A 139.217.146.62

Frame 7: 168 bytes on wire (1344 bits), 168 bytes captured (1344 bits) on interface 0
    Interface id: 0 (any)
        Interface name: any
    Encapsulation type: Linux cooked-mode capture (25)
    Arrival Time: Aug  5, 2019 14:42:31.504924497 CST
    [Time shift for this packet: 0.000000000 seconds]
    Epoch Time: 1564987351.504924497 seconds
    [Time delta from previous captured frame: 0.000075653 seconds]
    [Time delta from previous displayed frame: 0.000075653 seconds]
    [Time since reference or first frame: 0.003748760 seconds]
    Frame Number: 7
    Frame Length: 168 bytes (1344 bits)
    Capture Length: 168 bytes (1344 bits)
    [Frame is marked: False]
    [Frame is ignored: False]
    [Protocols in frame: sll:ethertype:ip:udp:dns]
    [Coloring Rule Name: UDP]
    [Coloring Rule String: udp]
Linux cooked capture
    Packet type: Unicast to us (0)
    Link-layer address type: 772
    Link-layer address length: 6
    Source: 00:00:00_00:00:00 (00:00:00:00:00:00)
    Unused: 0000
    Protocol: IPv4 (0x0800)
Internet Protocol Version 4, Src: 127.0.1.1, Dst: 127.0.0.1
    0100 .... = Version: 4
    .... 0101 = Header Length: 20 bytes (5)
    Differentiated Services Field: 0x00 (DSCP: CS0, ECN: Not-ECT)
        0000 00.. = Differentiated Services Codepoint: Default (0)
        .... ..00 = Explicit Congestion Notification: Not ECN-Capable Transport (0)
    Total Length: 152
    Identification: 0x821c (33308)
    Flags: 0x4000, Don't fragment
        0... .... .... .... = Reserved bit: Not set
        .1.. .... .... .... = Don't fragment: Set
        ..0. .... .... .... = More fragments: Not set
        ...0 0000 0000 0000 = Fragment offset: 0
    Time to live: 64
    Protocol: UDP (17)
    Header checksum: 0xb936 [validation disabled]
    [Header checksum status: Unverified]
    Source: 127.0.1.1
    Destination: 127.0.0.1
User Datagram Protocol, Src Port: 53, Dst Port: 40723
    Source Port: 53
    Destination Port: 40723
    Length: 132
    Checksum: 0xff97 [unverified]
    [Checksum Status: Unverified]
    [Stream index: 0]
    [Timestamps]
        [Time since first frame: 0.003748760 seconds]
        [Time since previous frame: 0.003748760 seconds]
Domain Name System (response)
    Transaction ID: 0x3eae
    Flags: 0x8180 Standard query response, No error
        1... .... .... .... = Response: Message is a response
        .000 0... .... .... = Opcode: Standard query (0)
        .... .0.. .... .... = Authoritative: Server is not an authority for domain
        .... ..0. .... .... = Truncated: Message is not truncated
        .... ...1 .... .... = Recursion desired: Do query recursively
        .... .... 1... .... = Recursion available: Server can do recursive queries
        .... .... .0.. .... = Z: reserved (0)
        .... .... ..0. .... = Answer authenticated: Answer/authority portion was not authenticated by the server
        .... .... ...0 .... = Non-authenticated data: Unacceptable
        .... .... .... 0000 = Reply code: No error (0)
    Questions: 1
    Answer RRs: 3
    Authority RRs: 0
    Additional RRs: 0
    Queries
        mirror.azure.cn: type A, class IN
            Name: mirror.azure.cn
            [Name Length: 15]
            [Label Count: 3]
            Type: A (Host Address) (1)
            Class: IN (0x0001)
    Answers
        mirror.azure.cn: type CNAME, class IN, cname mirror.trafficmanager.cn
            Name: mirror.azure.cn
            Type: CNAME (Canonical NAME for an alias) (5)
            Class: IN (0x0001)
            Time to live: 3344
            Data length: 24
            CNAME: mirror.trafficmanager.cn
        mirror.trafficmanager.cn: type CNAME, class IN, cname eastmirror.chinacloudapp.cn
            Name: mirror.trafficmanager.cn
            Type: CNAME (Canonical NAME for an alias) (5)
            Class: IN (0x0001)
            Time to live: 60
            Data length: 27
            CNAME: eastmirror.chinacloudapp.cn
        eastmirror.chinacloudapp.cn: type A, class IN, addr 139.217.146.62
            Name: eastmirror.chinacloudapp.cn
            Type: A (Host Address) (1)
            Class: IN (0x0001)
            Time to live: 60
            Data length: 4
            Address: 139.217.146.62
    [Request In: 1]
    [Time: 0.003748760 seconds]

No.     Time           Source                Destination           Protocol Length Info
      8 0.004007447    10.11.29.131          139.217.146.62        TCP      76     60686 → 80 [SYN] Seq=0 Win=29200 Len=0 MSS=1460 SACK_PERM=1 TSval=1759700185 TSecr=0 WS=128

Frame 8: 76 bytes on wire (608 bits), 76 bytes captured (608 bits) on interface 0
    Interface id: 0 (any)
        Interface name: any
    Encapsulation type: Linux cooked-mode capture (25)
    Arrival Time: Aug  5, 2019 14:42:31.505183184 CST
    [Time shift for this packet: 0.000000000 seconds]
    Epoch Time: 1564987351.505183184 seconds
    [Time delta from previous captured frame: 0.000258687 seconds]
    [Time delta from previous displayed frame: 0.000258687 seconds]
    [Time since reference or first frame: 0.004007447 seconds]
    Frame Number: 8
    Frame Length: 76 bytes (608 bits)
    Capture Length: 76 bytes (608 bits)
    [Frame is marked: False]
    [Frame is ignored: False]
    [Protocols in frame: sll:ethertype:ip:tcp]
    [Coloring Rule Name: HTTP]
    [Coloring Rule String: http || tcp.port == 80 || http2]
Linux cooked capture
    Packet type: Sent by us (4)
    Link-layer address type: 1
    Link-layer address length: 6
    Source: Dell_ca:f9:c7 (6c:2b:59:ca:f9:c7)
    Unused: 0000
    Protocol: IPv4 (0x0800)
Internet Protocol Version 4, Src: 10.11.29.131, Dst: 139.217.146.62
    0100 .... = Version: 4
    .... 0101 = Header Length: 20 bytes (5)
    Differentiated Services Field: 0x00 (DSCP: CS0, ECN: Not-ECT)
        0000 00.. = Differentiated Services Codepoint: Default (0)
        .... ..00 = Explicit Congestion Notification: Not ECN-Capable Transport (0)
    Total Length: 60
    Identification: 0x5038 (20536)
    Flags: 0x4000, Don't fragment
        0... .... .... .... = Reserved bit: Not set
        .1.. .... .... .... = Don't fragment: Set
        ..0. .... .... .... = More fragments: Not set
        ...0 0000 0000 0000 = Fragment offset: 0
    Time to live: 64
    Protocol: TCP (6)
    Header checksum: 0xa4de [validation disabled]
    [Header checksum status: Unverified]
    Source: 10.11.29.131
    Destination: 139.217.146.62
Transmission Control Protocol, Src Port: 60686, Dst Port: 80, Seq: 0, Len: 0
    Source Port: 60686
    Destination Port: 80
    [Stream index: 0]
    [TCP Segment Len: 0]
    Sequence number: 0    (relative sequence number)
    [Next sequence number: 0    (relative sequence number)]
    Acknowledgment number: 0
    1010 .... = Header Length: 40 bytes (10)
    Flags: 0x002 (SYN)
        000. .... .... = Reserved: Not set
        ...0 .... .... = Nonce: Not set
        .... 0... .... = Congestion Window Reduced (CWR): Not set
        .... .0.. .... = ECN-Echo: Not set
        .... ..0. .... = Urgent: Not set
        .... ...0 .... = Acknowledgment: Not set
        .... .... 0... = Push: Not set
        .... .... .0.. = Reset: Not set
        .... .... ..1. = Syn: Set
            [Expert Info (Chat/Sequence): Connection establish request (SYN): server port 80]
                [Connection establish request (SYN): server port 80]
                [Severity level: Chat]
                [Group: Sequence]
        .... .... ...0 = Fin: Not set
        [TCP Flags: ··········S·]
    Window size value: 29200
    [Calculated window size: 29200]
    Checksum: 0x45d4 [unverified]
    [Checksum Status: Unverified]
    Urgent pointer: 0
    Options: (20 bytes), Maximum segment size, SACK permitted, Timestamps, No-Operation (NOP), Window scale
        TCP Option - Maximum segment size: 1460 bytes
            Kind: Maximum Segment Size (2)
            Length: 4
            MSS Value: 1460
        TCP Option - SACK permitted
            Kind: SACK Permitted (4)
            Length: 2
        TCP Option - Timestamps: TSval 1759700185, TSecr 0
            Kind: Time Stamp Option (8)
            Length: 10
            Timestamp value: 1759700185
            Timestamp echo reply: 0
        TCP Option - No-Operation (NOP)
            Kind: No-Operation (1)
        TCP Option - Window scale: 7 (multiply by 128)
            Kind: Window Scale (3)
            Length: 3
            Shift count: 7
            [Multiplier: 128]
    [Timestamps]
        [Time since first frame in this TCP stream: 0.000000000 seconds]
        [Time since previous frame in this TCP stream: 0.000000000 seconds]

No.     Time           Source                Destination           Protocol Length Info
      9 0.010020167    139.217.146.62        10.11.29.131          TCP      76     80 → 60686 [SYN, ACK] Seq=0 Ack=1 Win=28960 Len=0 MSS=1440 SACK_PERM=1 TSval=3890471464 TSecr=1759700185 WS=128

Frame 9: 76 bytes on wire (608 bits), 76 bytes captured (608 bits) on interface 0
    Interface id: 0 (any)
        Interface name: any
    Encapsulation type: Linux cooked-mode capture (25)
    Arrival Time: Aug  5, 2019 14:42:31.511195904 CST
    [Time shift for this packet: 0.000000000 seconds]
    Epoch Time: 1564987351.511195904 seconds
    [Time delta from previous captured frame: 0.006012720 seconds]
    [Time delta from previous displayed frame: 0.006012720 seconds]
    [Time since reference or first frame: 0.010020167 seconds]
    Frame Number: 9
    Frame Length: 76 bytes (608 bits)
    Capture Length: 76 bytes (608 bits)
    [Frame is marked: False]
    [Frame is ignored: False]
    [Protocols in frame: sll:ethertype:ip:tcp]
    [Coloring Rule Name: HTTP]
    [Coloring Rule String: http || tcp.port == 80 || http2]
Linux cooked capture
    Packet type: Unicast to us (0)
    Link-layer address type: 1
    Link-layer address length: 6
    Source: JuniperN_ff:10:02 (00:10:db:ff:10:02)
    Unused: 0000
    Protocol: IPv4 (0x0800)
Internet Protocol Version 4, Src: 139.217.146.62, Dst: 10.11.29.131
    0100 .... = Version: 4
    .... 0101 = Header Length: 20 bytes (5)
    Differentiated Services Field: 0x00 (DSCP: CS0, ECN: Not-ECT)
        0000 00.. = Differentiated Services Codepoint: Default (0)
        .... ..00 = Explicit Congestion Notification: Not ECN-Capable Transport (0)
    Total Length: 60
    Identification: 0x0000 (0)
    Flags: 0x4000, Don't fragment
        0... .... .... .... = Reserved bit: Not set
        .1.. .... .... .... = Don't fragment: Set
        ..0. .... .... .... = More fragments: Not set
        ...0 0000 0000 0000 = Fragment offset: 0
    Time to live: 47
    Protocol: TCP (6)
    Header checksum: 0x0617 [validation disabled]
    [Header checksum status: Unverified]
    Source: 139.217.146.62
    Destination: 10.11.29.131
Transmission Control Protocol, Src Port: 80, Dst Port: 60686, Seq: 0, Ack: 1, Len: 0
    Source Port: 80
    Destination Port: 60686
    [Stream index: 0]
    [TCP Segment Len: 0]
    Sequence number: 0    (relative sequence number)
    [Next sequence number: 0    (relative sequence number)]
    Acknowledgment number: 1    (relative ack number)
    1010 .... = Header Length: 40 bytes (10)
    Flags: 0x012 (SYN, ACK)
        000. .... .... = Reserved: Not set
        ...0 .... .... = Nonce: Not set
        .... 0... .... = Congestion Window Reduced (CWR): Not set
        .... .0.. .... = ECN-Echo: Not set
        .... ..0. .... = Urgent: Not set
        .... ...1 .... = Acknowledgment: Set
        .... .... 0... = Push: Not set
        .... .... .0.. = Reset: Not set
        .... .... ..1. = Syn: Set
            [Expert Info (Chat/Sequence): Connection establish acknowledge (SYN+ACK): server port 80]
                [Connection establish acknowledge (SYN+ACK): server port 80]
                [Severity level: Chat]
                [Group: Sequence]
        .... .... ...0 = Fin: Not set
        [TCP Flags: ·······A··S·]
    Window size value: 28960
    [Calculated window size: 28960]
    Checksum: 0xe238 [unverified]
    [Checksum Status: Unverified]
    Urgent pointer: 0
    Options: (20 bytes), Maximum segment size, SACK permitted, Timestamps, No-Operation (NOP), Window scale
        TCP Option - Maximum segment size: 1440 bytes
            Kind: Maximum Segment Size (2)
            Length: 4
            MSS Value: 1440
        TCP Option - SACK permitted
            Kind: SACK Permitted (4)
            Length: 2
        TCP Option - Timestamps: TSval 3890471464, TSecr 1759700185
            Kind: Time Stamp Option (8)
            Length: 10
            Timestamp value: 3890471464
            Timestamp echo reply: 1759700185
        TCP Option - No-Operation (NOP)
            Kind: No-Operation (1)
        TCP Option - Window scale: 7 (multiply by 128)
            Kind: Window Scale (3)
            Length: 3
            Shift count: 7
            [Multiplier: 128]
    [SEQ/ACK analysis]
        [This is an ACK to the segment in frame: 8]
        [The RTT to ACK the segment was: 0.006012720 seconds]
        [iRTT: 0.006061628 seconds]
    [Timestamps]
        [Time since first frame in this TCP stream: 0.006012720 seconds]
        [Time since previous frame in this TCP stream: 0.006012720 seconds]

No.     Time           Source                Destination           Protocol Length Info
     10 0.010069075    10.11.29.131          139.217.146.62        TCP      68     60686 → 80 [ACK] Seq=1 Ack=1 Win=29312 Len=0 TSval=1759700191 TSecr=3890471464

Frame 10: 68 bytes on wire (544 bits), 68 bytes captured (544 bits) on interface 0
    Interface id: 0 (any)
        Interface name: any
    Encapsulation type: Linux cooked-mode capture (25)
    Arrival Time: Aug  5, 2019 14:42:31.511244812 CST
    [Time shift for this packet: 0.000000000 seconds]
    Epoch Time: 1564987351.511244812 seconds
    [Time delta from previous captured frame: 0.000048908 seconds]
    [Time delta from previous displayed frame: 0.000048908 seconds]
    [Time since reference or first frame: 0.010069075 seconds]
    Frame Number: 10
    Frame Length: 68 bytes (544 bits)
    Capture Length: 68 bytes (544 bits)
    [Frame is marked: False]
    [Frame is ignored: False]
    [Protocols in frame: sll:ethertype:ip:tcp]
    [Coloring Rule Name: HTTP]
    [Coloring Rule String: http || tcp.port == 80 || http2]
Linux cooked capture
    Packet type: Sent by us (4)
    Link-layer address type: 1
    Link-layer address length: 6
    Source: Dell_ca:f9:c7 (6c:2b:59:ca:f9:c7)
    Unused: 0000
    Protocol: IPv4 (0x0800)
Internet Protocol Version 4, Src: 10.11.29.131, Dst: 139.217.146.62
    0100 .... = Version: 4
    .... 0101 = Header Length: 20 bytes (5)
    Differentiated Services Field: 0x00 (DSCP: CS0, ECN: Not-ECT)
        0000 00.. = Differentiated Services Codepoint: Default (0)
        .... ..00 = Explicit Congestion Notification: Not ECN-Capable Transport (0)
    Total Length: 52
    Identification: 0x5039 (20537)
    Flags: 0x4000, Don't fragment
        0... .... .... .... = Reserved bit: Not set
        .1.. .... .... .... = Don't fragment: Set
        ..0. .... .... .... = More fragments: Not set
        ...0 0000 0000 0000 = Fragment offset: 0
    Time to live: 64
    Protocol: TCP (6)
    Header checksum: 0xa4e5 [validation disabled]
    [Header checksum status: Unverified]
    Source: 10.11.29.131
    Destination: 139.217.146.62
Transmission Control Protocol, Src Port: 60686, Dst Port: 80, Seq: 1, Ack: 1, Len: 0
    Source Port: 60686
    Destination Port: 80
    [Stream index: 0]
    [TCP Segment Len: 0]
    Sequence number: 1    (relative sequence number)
    [Next sequence number: 1    (relative sequence number)]
    Acknowledgment number: 1    (relative ack number)
    1000 .... = Header Length: 32 bytes (8)
    Flags: 0x010 (ACK)
        000. .... .... = Reserved: Not set
        ...0 .... .... = Nonce: Not set
        .... 0... .... = Congestion Window Reduced (CWR): Not set
        .... .0.. .... = ECN-Echo: Not set
        .... ..0. .... = Urgent: Not set
        .... ...1 .... = Acknowledgment: Set
        .... .... 0... = Push: Not set
        .... .... .0.. = Reset: Not set
        .... .... ..0. = Syn: Not set
        .... .... ...0 = Fin: Not set
        [TCP Flags: ·······A····]
    Window size value: 229
    [Calculated window size: 29312]
    [Window size scaling factor: 128]
    Checksum: 0x45cc [unverified]
    [Checksum Status: Unverified]
    Urgent pointer: 0
    Options: (12 bytes), No-Operation (NOP), No-Operation (NOP), Timestamps
        TCP Option - No-Operation (NOP)
            Kind: No-Operation (1)
        TCP Option - No-Operation (NOP)
            Kind: No-Operation (1)
        TCP Option - Timestamps: TSval 1759700191, TSecr 3890471464
            Kind: Time Stamp Option (8)
            Length: 10
            Timestamp value: 1759700191
            Timestamp echo reply: 3890471464
    [SEQ/ACK analysis]
        [This is an ACK to the segment in frame: 9]
        [The RTT to ACK the segment was: 0.000048908 seconds]
        [iRTT: 0.006061628 seconds]
    [Timestamps]
        [Time since first frame in this TCP stream: 0.006061628 seconds]
        [Time since previous frame in this TCP stream: 0.000048908 seconds]

No.     Time           Source                Destination           Protocol Length Info
     11 0.010296788    10.11.29.131          139.217.146.62        HTTP     534    GET / HTTP/1.1 

Frame 11: 534 bytes on wire (4272 bits), 534 bytes captured (4272 bits) on interface 0
    Interface id: 0 (any)
        Interface name: any
    Encapsulation type: Linux cooked-mode capture (25)
    Arrival Time: Aug  5, 2019 14:42:31.511472525 CST
    [Time shift for this packet: 0.000000000 seconds]
    Epoch Time: 1564987351.511472525 seconds
